,name,year,duration,description,genre,country
0,Побег из Шоушенка,1994,2h 22m,"Банкир, осужденный за уксорицид, образует дружбу за четверть века с закаленным осужденным, сохраняя при этом его невиновность и пытаясь оставаться надежды на простое сострадание.","['Эпический', 'Период драма', 'Тюремная драма', 'Драма']",United States
1,Крестный отец,1972,2h 55m,Старение патриарха организованной криминальной династии передает контроль над его тайной империей его неохотному сыну.,"['Эпический', 'Гангстер', 'Трагедия', 'Преступление', 'Драма']",United States
2,Тёмный рыцарь,2008,2h 32m,"Когда угроза, известная как Джокер, наносит ущерб и хаос народах Готэма, Бэтмен, Джеймс Гордон и Харви Дент должны работать вместе, чтобы положить конец безумию.","['Действие Эпик', 'Эпический', 'Супергерой', 'Трагедия', 'Действие', 'Преступление', 'Драма', 'Триллер']",United States
3,Крестный отец 2,1974,3h 22m,"Ранняя жизнь и карьера Вито Корлеоне в 1920 -х годах изображаются, в то время как его сын Майкл расширяет и подтягивает свою власть в отношении синдиката по семейной преступности.","['Эпический', 'Гангстер', 'Трагедия', 'Преступление', 'Драма']",United States
4,12 разгневанных мужчин,1957,1h 36m,"Присяжные в суде по делу об убийстве в Нью -Йорке разочарованы одним членом, чей скептически осторожность заставляет их более тщательно рассмотреть доказательства, прежде чем принять поспешное приговор.","['Юридическая драма', 'Психологическая драма', 'Преступление', 'Драма']",United States
5,Властелин колец: Возвращение короля,2003,3h 21m,"Гандальф и Арагорн ведут мир людей против армии Саурона, чтобы привлечь свой взгляд от Фродо и Сэма, когда они приближаются к Маунт -Дум с одним кольцом.","['Действие Эпик', 'Приключенческий эпос', 'Эпический', 'Фэнтезийный эпический', 'Горные приключения', 'Квест', 'Меч и колдовство', 'Трагедия', 'Приключение', 'Драма']",New Zealand
6,Список Шиндлера,1993,3h 15m,"В оккупированной немецкой Поль году во время Второй мировой войны промышленный Оскар Шиндлер постепенно заинтересован в своей еврейской рабочей силе после того, как нацисты были свидетелем их преследования со стороны нацистов.","['Docudrama', 'Эпический', 'Исторический эпический', 'Период драма', 'Тюремная драма', 'Трагедия', 'Биография', 'Драма', 'История']",United States
7,Криминальное чтиво,1994,2h 34m,"Жизнь двух наемников толпы, боксера, гангстера и его жены, и пары закусочных бандитов переплетаются в четырех сказках о насилии и искуплении.","['Темная комедия', 'Преступление на наркотиках', 'Гангстер', 'Преступление', 'Драма']",United States
8,Властелин колец: Братство кольца,2001,2h 58m,"Крутый хоббит из Шира и восемь компаньонов отправился в путешествие, чтобы уничтожить мощное кольцо и спасти Средиземье от Темного лорда Саурона.","['Действие Эпик', 'Приключенческий эпос', 'Эпический', 'Фэнтезийный эпический', 'Квест', 'Меч и колдовство', 'Приключение', 'Драма', 'Фантастика']",New Zealand
9,"Хороший, плохой, злой",1966,2h 41m,"Мошенничество на щедрости присоединяется к двум мужчинам в непростительном союзе против третьего в гонке, чтобы найти целое состояние в золоте, похороненное на отдаленном кладбище.","['Приключенческий эпос', 'Темная комедия', 'Пустынное приключение', 'Эпический', 'Период драма', 'Квест', 'Спагетти Вестерн', 'Западный Эпик', 'Приключение', 'Западный']",Italy
10,Форрест Гамп,1994,2h 22m,"История Соединенных Штатов с 1950 -х годов до 70 -х годов разворачивается с точки зрения мужчины из Алабамы с IQ из 75 лет, который жаждет воссоединиться со своей детской возлюбленной.","['Эпический', 'Драма', 'Роман']",United States
11,Властелин колец: Две крепости,2002,2h 59m,"В то время как Фродо и Сэм Эдж ближе к Мордору с помощью Shifty Gollum, разделенное общение выступает против нового союзника Саурона, Сарумана и его полщиков Исигарда.","['Действие Эпик', 'Приключенческий эпос', 'Темная фантазия', 'Эпический', 'Фэнтезийный эпический', 'Квест', 'Меч и колдовство', 'Приключение', 'Драма', 'Фантастика']",New Zealand
12,Бойцовский клуб,1999,2h 19m,"Офисный работник бессонницы и производитель мыльной помощи дьяволам образуют подземный бой-клуб, который превращается в гораздо больше.","['Психологическая драма', 'Психологический триллер', 'Драма на рабочем месте', 'Преступление', 'Драма', 'Триллер']",Germany
13,Начало,2010,2h 28m,"Вор, который крадет корпоративные секреты с помощью технологии совместного использования мечты, дает обратную задачу посадки идеи в сознание C.E.O., но его трагическое прошлое может обребить профессионал ... прочитать все","['Действие Эпик', 'Приключенческий эпос', 'Эпический', 'Психологический триллер', 'Научно-фантастическая эпопея', 'Действие', 'Приключение', 'Научная фантастика', 'Триллер']",United States
14,Звёздные войны: Эпизод 5 - Империя наносит ответный удар,1980,2h 4m,"После того, как Империя одолевает альянс повстанцев, Люк Скайуокер начинает тренироваться с мастером Джедай Йода, в то время как Дарт Вейдер и охотник за головами Боба Фетт преследуют своих друзей через галактику.","['Действие Эпик', 'Приключенческий эпос', 'Темная фантазия', 'Эпический', 'Фэнтезийный эпический', 'Globetrotting Adventure', 'Квест', 'Научно-фантастическая эпопея', 'Космическая научная фантастика', 'Меч и колдовство']",United States
15,Матрица,1999,2h 16m,"Когда прекрасный незнакомец приводит компьютерного хакера Нео к запрещенному подземному миру, он обнаруживает шокирующую правду-жизнь, которую он знает,-это сложный обман злой кибер-интеллекты.","['Действие Эпик', 'Искусственный интеллект', 'Киберпанк', 'Дистопическая научная фантастика', 'Gun Fu', 'Боевые искусства', 'Научно-фантастическая эпопея', 'Действие', 'Научная фантастика']",United States
16,Славные парни,1990,2h 25m,"История Генри Хилла и его жизни в мафии, освещая его отношения с его женой Карен и его партнерами по толпике Джимми Конвея и Томми Девито.","['Docudrama', 'Гангстер', 'Истинное преступление', 'Биография', 'Преступление', 'Драма']",United States
17,Пролетая над гнездом кукушки,1975,2h 13m,"Осенью 1963 года ветеран Корейской войны и преступник умоляет безумие и поступает в психиатрическое учреждение, где он снимает испуганных пациентов против тиранической медсестры.","['Медицинская драма', 'Психологическая драма', 'Драма']",United States
18,Интерстеллар,2014,2h 49m,"Когда в будущем Земля станет необитаемой, фермеру и бывшему пилоту на NASA Джозеф Купер поручено пилотировать космический корабль вместе с командой исследователей, чтобы найти новую планету для людей.","['Приключенческий эпос', 'Эпический', 'Квест', 'Научно-фантастическая эпопея', 'Космическая научная фантастика', 'Путешествие во времени', 'Приключение', 'Драма', 'Научная фантастика']",United States
19,Семь,1995,2h 7m,"Два детектива, новичок и ветеран, охотятся на серийного убийцы, который использует семь смертельных грехов в качестве своих мотивов.","['Полицейская драма', 'Вершинный детектив', 'Юридическая драма', 'Полицейские процедурные', 'Психологическая драма', 'Психологический триллер', 'Серийный убийца', 'Преступление', 'Драма', 'Тайна']",United States
20,Эта замечательная жизнь,1946,2h 10m,"Ангела посылают с небес, чтобы помочь отчаянно разочарованному бизнесмену, показав ему, какая жизнь была бы, если бы он никогда не существовал.","['Хороший роман', 'Праздничная семья', 'Праздничный роман', 'Психологическая драма', 'Сверхъестественная фантазия', 'Драма', 'Семья', 'Фантастика', 'Праздничный день', 'Роман']",United States
21,Семь самураев,1954,3h 27m,"Фермеры из деревни, эксплуатируемой бандитами, нанимают ветеран -самурай для защиты, и он собирает шесть других самураев, чтобы присоединиться к нему.","['Действие Эпик', 'Эпический', 'Период драма', 'Самурай', 'Действие', 'Драма']",Japan
22,Молчание ягнят,1991,1h 58m,"Молодой Ф.Б.И. Ка курсант должен получить помощь в заключении и манипулятивном убийце каннибала, чтобы помочь поймать другого серийного убийцы, сумасшедшего, который скорее пострадает.","['Полицейские процедурные', 'Психологическая драма', 'Психологический ужас', 'Психологический триллер', 'Серийный убийца', 'Слэшер ужас', 'Преступление', 'Драма', 'Ужас', 'Триллер']",United States
23,Спасти рядового Райана,1998,2h 49m,"После посадки в Нормандии группа солдат США идет за вражеской линии, чтобы забрать десантник, чьи братья были убиты в бою.","['Эпический', 'Период драма', 'Военный эпический', 'Драма', 'Война']",United States
24,Город Бога,2002,2h 10m,"В трущобах Рио два детских путях расходятся, когда один из них пытается стать фотографом, а другой - королем.","['Капер', 'Совершеннолетие', 'Гангстер', 'Преступление', 'Драма']",Brazil
25,Зелёная миля,1999,3h 9m,"Смертельный охранник узнает, что нежный гигант в его атаке обладает таинственным подарком.","['Период драма', 'Тюремная драма', 'Сверхъестественная фантазия', 'Трагедия', 'Преступление', 'Драма', 'Фантастика', 'Тайна']",United States
26,Жизнь прекрасна,1997,1h 56m,"Когда открытый еврейский официант и его сын становятся жертвами Холокоста, он использует идеальную смесь воли, юмора и воображения, чтобы защитить своего сына от опасностей вокруг их лагеря.","['Период драма', 'Романтическая комедия', 'Трагедия', 'Трагический роман', 'Комедия', 'Драма', 'Роман', 'Война']",Italy
27,Терминатор 2: Судный день,1991,2h 17m,"Киборг, идентичный тем, кто не смог убить Сару Коннор, теперь должен защитить своего десятилетнего сына Джона от еще более продвинутого и могущественного киборга.","['Действие Эпик', 'Искусственный интеллект', 'Киберпанк', 'Дистопическая научная фантастика', 'Научно-фантастическая эпопея', 'Путешествие во времени', 'Действие', 'Приключение', 'Научная фантастика']",United States
28,Звёздные войны,1977,2h 1m,"Люк Скайуокер объединяет усилия с рыцарем-джедаем, дерзким пилотом, вуки и двумя дроидами, чтобы спасти галактику от боевой станции, разрушающей мир империи, а также пытается спасти ... прочитать все","['Действие Эпик', 'Приключенческий эпос', 'Эпический', 'Фэнтезийный эпический', 'Квест', 'Научно-фантастическая эпопея', 'Космическая научная фантастика', 'Меч и колдовство', 'Действие', 'Приключение']",United States
29,Назад в будущее,1985,1h 56m,"Марти МакФлай, 17-летний ученик средней школы, случайно отправил 30 лет в прошлое в путешествии во времени Делореан, изобретенного его близким другом, научным сотрудником Доком Брауном.","['Комедия с высокой концепцией', 'Подростковое приключение', 'Подростка комедия', 'Путешествие во времени', 'Городское приключение', 'Приключение', 'Комедия', 'Научная фантастика']",United States
30,Унесённые призраками,2001,2h 4m,"Во время переезда своей семьи в пригороды угрюмая 10-летняя девочка бродит в мир, которым управляют боги, ведьмы и духи, и где люди превращаются в зверей.","['Аниме', 'Совершеннолетие', 'Сказка', 'Нарисованная вручную анимацию', 'Квест', 'Сверхъестественная фантазия', 'Приключение', 'Анимация', 'Семья', 'Фантастика']",Japan
31,Пианист,2002,2h 30m,"Во время Второй мировой войны известный польский музыкант Wladyslaw сталкивается с различной борьбой, поскольку он теряет контакт со своей семьей. Когда ситуация ухудшается, он прячется в руинах Варшавы, чтобы выжить.","['Docudrama', 'Эпический', 'Период драма', 'Трагедия', 'Военный эпический', 'Биография', 'Драма', 'Музыка', 'Война']",France
32,Гладиатор,2000,2h 35m,"Бывший римский генерал намерен точно месть против коррумпированного императора, который убил его семью и отправил его в рабство.","['Действие Эпик', 'Приключенческий эпос', 'Эпический', 'Период драма', 'Меч и сандалия', 'Действие', 'Приключение', 'Драма']",United States
33,Паразиты,2019,2h 12m,Жадность и дискриминация класса угрожают недавно сформированным симбиотическим отношениям между богатой семьей парка и обездоленным кланом Ким.,"['Темная комедия', 'Корейская драма', 'Психологический триллер', 'Трагедия', 'Драма', 'Триллер']",South Korea
34,Психо,1960,1h 49m,"Секретарь по прибеганию к растрату укрывается в уединенном калифорнийском мотеле, принадлежащем подавленному человеку и его властной матери.","['Темная комедия', 'Психологический ужас', 'Психологический триллер', 'Слэшер ужас', 'Тайна ожидания', 'Ужас', 'Тайна', 'Триллер']",United States
35,Король Лев,1994,1h 28m,"Принц Лев Симба и его отец подвергаются нападению его горького дяди, который хочет подняться на престол.","['Приключение животных', 'Совершеннолетие', 'Нарисованная вручную анимацию', 'Джунгли Приключение', 'Приключение', 'Анимация', 'Драма', 'Семья', 'Фантастика', 'Мюзикл']",United States
36,Могила светлячков,1988,1h 28m,Молодой мальчик и его младшая сестра изо всех сил пытаются выжить в Японии во время Второй мировой войны.,"['Анимация для взрослых', 'Аниме', 'Нарисованная вручную анимацию', 'Период драма', 'Анимация', 'Драма', 'Война']",Japan
37,Отступники,2006,2h 31m,"Полицейский под прикрытием и родинка в полиции пытаются идентифицировать друг друга, проникнув в ирландскую банду в Южном Бостоне.","['Полицейская драма', 'Эпический', 'Гангстер', 'Преступление', 'Драма', 'Триллер']",United States
38,Одержимость,2014,1h 46m,"Многообещающий молодой барабанщик записывается в музыкальную консерваторию, где его мечты о величии обучаются инструктором, который не остановится ни перед чем, чтобы реализовать потенциал студента.","['Психологическая драма', 'Драма', 'Музыка']",United States
39,Харакири,1962,2h 13m,"Когда Ронин, прося Сеппуку во дворце феодального лорда, рассказывается о жестоком самоубийстве другого Ронина, который ранее посещал, он показывает, как их прошлые переплетаются - и при этом ... прочтите все","['Период драма', 'Драма', 'Тайна']",Japan
40,Американская история Икс,1998,1h 59m,"Живая жизнью, отмеченная насилием, Неонацистский Дерек, наконец, отправляется в тюрьму после убийства двух чернокожих молодых людей. После его освобождения Дерек клянется измениться; Он надеется предотвратить его брата Дэнни, который идентифицирует","['Тюремная драма', 'Трагедия', 'Преступление', 'Драма']",United States
41,Престиж,2006,2h 10m,Соперничающие маги 19-го века вступают в горькую битву за коммерческие секреты.,"['Период драма', 'Стимпанк', 'Трагедия', 'Драма', 'Тайна', 'Научная фантастика', 'Триллер']",United Kingdom
42,Леон,1994,1h 50m,"12-летняя Матильда неохотно принимает Леон, профессиональный убийца Леона, после того, как ее семья убита. Необычные отношения формируются, когда она становится его протеже и изучает убийцу ... читать все","['Гангстер', 'Армия с одной личной армией', 'Действие', 'Преступление', 'Драма', 'Триллер']",France
43,Человек-паук: Паутина вселенных,2023,2h 20m,"Путешествуя по мультивселенной, Майлз Моралес встречает новую команду пауков, состоящую из героев из разных измерений. Но когда герои сталкиваются с тем, как справиться с новой угрозой, м ... прочитайте все","['Компьютерная анимация', 'Супергерой', 'Сверхъестественная фантазия', 'Подростковое приключение', 'Городское приключение', 'Действие', 'Приключение', 'Анимация', 'Семья', 'Фантастика']",United States
44,Касабланка,1942,1h 42m,"Циничный экспатриант американский владелец кафе изо всех сил пытается решить, помогать ли его бывшему любовнику и ее бегтерцу избежать нацистов во французском Марокко.","['Драма', 'Роман', 'Война']",United States
