,name,year,duration,description,genre,country
93,Охота,2012,1h 55m,"Учитель живет одинокой жизнью, все время борясь за опеку своего сына. Его жизнь постепенно становится лучше, когда он находит любовь и получает хорошие новости от своего сына, но его новая удача - это ... прочитать все","['Психологическая драма', 'Трагедия', 'Драма']",Denmark
94,Вечное сияние чистого разума,2004,1h 48m,"Когда их отношения становятся кислыми, пара проходит медицинскую процедуру, чтобы навсегда стираться друг от друга из их воспоминаний.","['Темный роман', 'Психологическая драма', 'Драма', 'Роман', 'Научная фантастика']",United States
95,Жить,1952,2h 23m,"Бюрократ пытается найти смысл в своей жизни после того, как обнаружит, что у него терминальный рак.","['Психологическая драма', 'Трагедия', 'Драма']",Japan
96,2001 год: Космическая одиссея,1968,2h 29m,"Когда на Луне раскрывается таинственный артефакт, космический корабль, укомплектованный двумя людьми, и один суперкомпьютер отправляется в Юпитер, чтобы найти его происхождение.","['Приключенческий эпос', 'Искусственный интеллект', 'Эпический', 'Психологическая драма', 'Научно-фантастическая эпопея', 'Космическая научная фантастика', 'Приключение', 'Научная фантастика']",United Kingdom
97,Бешеные псы,1992,1h 39m,"Когда простой украшение ограблений идет ужасно неправильно, выжившие преступники начинают подозревать, что один из них - полицейский информатор.","['Гангстер', 'Ограбление', 'Преступление', 'Триллер']",United States
98,Квартира,1960,2h 5m,"Манхэттенский страховой клерк пытается подняться в своей компании, позволяя ее руководителям использовать его квартиру для свидания, но офисная политика и его собственные романтические надежды усложняют вопросы.","['Фарс', 'Праздничная комедия', 'Праздничный роман', 'Романтическая комедия', 'Комедия', 'Драма', 'Праздничный день', 'Роман']",United States
99,Пожары,2010,2h 11m,"Близнецы отправятся на Ближний Восток, чтобы открыть для себя семейную историю и выполнить последние пожелания своей матери.","['Тайна ожидания', 'Драма', 'Тайна', 'Война']",Canada
100,Лоуренс Аравийский,1962,3h 47m,"История Т.Е. Лоуренс, английский офицер, который успешно объединился и руководил разнообразными, часто враждующими арабскими племенами во время Первой мировой войны, чтобы сражаться с турками.","['Приключенческий эпос', 'Пустынное приключение', 'Эпический', 'Трагедия', 'Военный эпический', 'Приключение', 'Биография', 'Драма', 'Война']",United Kingdom
101,Лицо со шрамом,1983,2h 50m,"В 1980-х годах определенный кубинский иммигрант, настроенный на преступник, становится крупнейшим контрабандистом наркотиков в Майами и в конечном итоге отменен своей собственной наркоманией.","['Преступление на наркотиках', 'Эпический', 'Гангстер', 'Трагедия', 'Преступление', 'Драма']",United States
102,Двойная страховка,1944,1h 47m,"Страховой представитель соблазняется недовольной домохозяйкой в ​​схему страхового мошенничества и убийства, которая вызывает подозрение его коллеги, следователя по претензиям.","['Фильм нуар', 'Вершинный детектив', 'Преступление', 'Драма', 'Тайна', 'Триллер']",United States
103,На север через северо-запад,1959,2h 16m,"Руководитель по рекламе в Нью -Йорке идет в бегах после того, как его приняли за правительственный агент группой иностранных шпионов, и влюбляется в женщину, чьи лояльности он начинает сомневаться.","['Шпион', 'Приключение', 'Драма', 'Тайна', 'Триллер']",United States
104,Схватка,1995,2h 50m,"Группа высококлассных профессиональных воров начинает чувствовать жар от LAPD, когда они неосознанно оставляют словесную подсказку в своем последнем ограблении.","['Действие Эпик', 'Полицейская драма', 'Эпический', 'Гангстер', 'Ограбление', 'Действие', 'Преступление', 'Драма']",United States
105,Гражданин Кейн,1941,1h 59m,"После смерти издательства магната Чарльза Фостера Кейна, журналисты пытаются раскрыть значение его последнего высказывания: «Роузбуд».","['Эпический', 'Период драма', 'Трагедия', 'Драма', 'Тайна']",United States
106,Вверх,2009,1h 36m,"78-летний Карл Фредриксен отправляется в Южную Америку в своем доме, оборудованном воздушными шарами, непреднамеренно взяв молодого устремления.","['Совершеннолетие', 'Компьютерная анимация', 'Globetrotting Adventure', 'Приключение', 'Анимация', 'Комедия', 'Драма', 'Семья']",United States
107,М убийца,1931,1h 57m,"Когда полиция в немецком городе не может поймать убийца ребенка, другие преступники присоединяются к охоте.","['Психологический триллер', 'Серийный убийца', 'Тайна ожидания', 'Преступление', 'Тайна', 'Триллер']",Germany
108,Цельнометаллическая оболочка,1987,1h 56m,"Прагматичный морской пехотинец наблюдает за дегуманизирующими последствиями, которые война во Вьетнаме оказывает на своих собратьев -новобранцев от своих жестоких тренировок в кролическом лагере до кровавой улицы, борьбы с Хюэ.","['Темная комедия', 'Период драма', 'Драма', 'Война']",United Kingdom
109,Головокружение,1958,2h 8m,"Бывший детектив полиции Сан -Франциско жонглирует со своими личными демонами и становясь одержимой навязчиво красивой женщиной, которую его наняли, чтобы трость, которая может быть глубоко прочитать все","['Психологический триллер', 'Трагедия', 'Тайна', 'Роман', 'Триллер']",United States
110,Амели,2001,2h 2m,"Несмотря на то, что молодая официантка Амели решает помочь людям найти счастье. Ее стремление распространять радость приводит ее в путешествие, во время которого она находит настоящую любовь.","['Хороший роман', 'Причудливая комедия', 'Романтическая комедия', 'Комедия', 'Роман']",France
111,Заводной апельсин,1971,2h 16m,Алекс Деярдж и его Droogs варварся разлагаются в ближайшее время.,"['Темная комедия', 'Дистопическая научная фантастика', 'Преступление', 'Научная фантастика']",United Kingdom
112,Развод Надера и Симин,2011,2h 3m,"Супружеская пара сталкивается с трудным решением - улучшить жизнь своего ребенка, переехав в другую страну или остаться в Иране и присматривать за ухудшением родителей, у которого есть болезнь Альцгей ... читать все","['Юридическая драма', 'Психологическая драма', 'Драма']",Iran
113,Убить пересмешника,1962,2h 9m,"Овдовевший адвокат в эпохе депрессии Алабамы защищает чернокожих от ложного обвинения в изнасиловании, обучая своих маленьких детей о печальной реальности предрассудков.","['Юридическая драма', 'Период драма', 'Преступление', 'Драма']",United States
114,Оппенгеймер,2023,3h,"Драматизация истории жизни Дж. Роберта Оппенгеймера, физика, у которого была большая рука в развитии атомных бомб, которые положили конец Второй мировой войне.","['Docudrama', 'Эпический', 'Исторический эпический', 'Период драма', 'Психологическая драма', 'Биография', 'Драма', 'История']",United States
115,Крепкий орешек,1988,2h 12m,"Полицейский из Нью -Йорка пытается спасти свою отчужденную жену и несколько других, взятых террористов во время рождественской вечеринки на Накатоми Плаза в Лос -Анджелесе.","['Катастрофа', 'Армия с одной личной армией', 'Действие', 'Праздничный день', 'Триллер']",United States
116,Афера,1973,2h 9m,"Два сбора объединяются, чтобы снять Ultimate Con.","['Капер', 'Комедия', 'Преступление', 'Драма']",United States
117,Звёздочки на земле,2007,2h 42m,"Считается, что молодой мальчик не является чем -то иным, как ленивым нарушителем нарушителя, пока у нового учителя искусства не будет терпения и сострадания, чтобы обнаружить реальную проблему, стоящую за его борьбой в школе.","['Драма', 'Семья']",India
118,Индиана Джонс и последний крестовый поход,1989,2h 7m,"В 1938 году, после того, как его отец пропал без вести, преследуя Святой Грааль, Индиана Джонс снова оказывается против нацистов, чтобы помешать им получить свои силы.","['Приключенческий эпос', 'Пустынное приключение', 'Globetrotting Adventure', 'Квест', 'Действие', 'Приключение']",United States
119,Метрополис,1927,2h 33m,"В футуристическом городе, резко разделенном между рабочим классом и планировщиками города, сын вдохновителя города влюбляется в пророка рабочего класса, который предсказывает пришествие ... Прочтите все","['Дистопическая научная фантастика', 'Эпический', 'Научно-фантастическая эпопея', 'Стимпанк', 'Драма', 'Научная фантастика']",Germany
120,Большой куш,2000,1h 44m,"Ноблезные боксерские промоутеры, жестокие букмекеры, русский гангстер, некомпетентные грабители -любители и предположительно еврейские ювелиры борются за то, чтобы выследить бесценный украденный бриллиант.","['Капер', 'Темная комедия', 'Гангстер', 'Комедия', 'Преступление']",United Kingdom
121,1917,2019,1h 59m,"6 апреля 1917 года. По мере того, как пехотный батальон собирается, чтобы вести войну глубоко на территории противника, два солдата назначаются для участия в гонке со временем и донесут сообщение, которое остановит 1600 человек из WA ... Прочтите все","['Эпический', 'Период драма', 'Военный эпический', 'Действие', 'Драма', 'Война']",United Kingdom
122,Секреты Лос-Анджелеса,1997,2h 18m,"По мере роста коррупции в 1950 -х годах Лос -Анджелеса, три полицейских - один из проливных, один жестокий и один неряшливый - расследуйте серию убийств со своим собственным брендом справедливости.","['Триллер заговора', 'Полицейская драма', 'Вершинный детектив', 'Период драма', 'Полицейские процедурные', 'Тайна ожидания', 'Whodunnit', 'Преступление', 'Драма', 'Тайна']",United States
123,Похитители велосипедов,1948,1h 29m,"В послевоенной Италии похищен велосипед рабочего класса, угрожая его усилиям по поиску работы. Он и его сын решили найти это.","['Трагедия', 'Драма']",Italy
124,Бункер,2004,2h 36m,"Траудл Юнге, финальный секретарь Адольфа Гитлера, рассказывает о последних днях нацистского диктатора в его Берлинском бункере в конце Второй мировой войны.","['Docudrama', 'Политическая драма', 'Трагедия', 'Биография', 'Драма', 'История', 'Война']",Germany
125,Дангал. Слово борца,2016,2h 41m,"Махавир Сингх Фогат, бывший борцов","['Действие', 'Биография', 'Драма', 'Спорт']",India
126,Таксист,1976,1h 54m,"Мраво неуравновешенный ветеран работает ночным таксистом в Нью -Йорке, где воспринимаемый декаданс и подлости подпитывают его стремление к насильственным действиям.","['Психологическая драма', 'Преступление', 'Драма']",United States
127,Гамильтон,2020,2h 40m,Реальная жизнь одного из главных отцов -основателей Америки и первого секретаря казначейства Александр Гамильтон. Захвачен в прямом эфире на Бродвее из театра Ричарда Роджерса с оригиналом ... читать все,"['Эпический', 'Биография', 'Драма', 'История', 'Мюзикл']",United States
128,Волк с Уолл-стрит,2013,3h,"Основываясь на истинной истории Джордана Белфорта, от его подъема до богатого фондового брокера, проживающего высокую жизнь до его падения, связанного с преступностью, коррупцией и федеральным правительством.","['Темная комедия', 'Docudrama', 'Эпический', 'Групкая комедия', 'Сатира', 'Истинное преступление', 'Биография', 'Комедия', 'Преступление', 'Драма']",United States
129,Бэтмен: Начало,2005,2h 20m,"Свидев смерть своих родителей, миллиардер Брюс Уэйн узнает искусство борьбы, чтобы противостоять несправедливости. Когда он возвращается в Готэм в качестве Бэтмена, он должен остановить секретное общество, которое намеревается ... читать все","['Действие Эпик', 'Эпический', 'Супергерой', 'Трагедия', 'Действие', 'Драма']",United States
130,Зеленая книга,2018,2h 10m,Итальянско-американский вышибала рабочего класса становится движущей силой афроамериканского классического пианиста в туре по местам по американскому югу 1960-х годов.,"['Docudrama', 'Период драма', 'Дорожная поездка', 'Биография', 'Комедия', 'Драма', 'Музыка']",United States
131,На несколько долларов больше,1965,2h 12m,"Два убийцы наградных с аналогичными намерениями, но различные мотивы объединяются, чтобы выследить психотический мексиканский преступник, прежде чем он и его банда смогут выполнить смелое ограбление банка.","['Армия с одной личной армией', 'Спагетти Вестерн', 'Драма', 'Западный']",Italy
132,Шоу Трумана,1998,Peter Weir,"Продавец страхования начинает подозревать, что вся его жизнь на самом деле является своего рода реалити -шоу.","['Темная комедия', 'Комедия с высокой концепцией', 'Психологическая драма', 'Сатира', 'Шоу -бизнес драма', 'Комедия', 'Драма']",United States
133,Нюрнбергский процесс,1961,2h 59m,"Художественное изображение судебного разбирательства 1947 года, третьего из двенадцати судебных процессов нацистских военных преступников, проведенных американскими оккупационными силами в Нюрнберге, Германия, в которых бывшие судьи ... прочитали все","['Юридическая драма', 'Драма', 'Война']",United States
134,В джазе только девушки,1959,2h 1m,"После того, как два музыканта-мужчины стали свидетелями хита толпы, они бежат от государства в группе, замаскированной как женщины, замаскированной как женщины, но возникают дальнейшие осложнения.","['Приятель комедия', 'Фарс', 'Сатира', 'Винтбол комедия', 'Комедия', 'Музыка', 'Роман']",United States
135,Малыш,1921,1h 8m,"Бродяга заботится о брошенном ребенке, но события подвергают их отношениям их отношения.","['Приятель комедия', 'Защелка', 'Комедия', 'Драма', 'Семья']",United States
136,Остров проклятых,2010,2h 18m,"Два американских маршала отправляются в психиатрическое учреждение на негостеприимном острове, чтобы исследовать исчезновение пациента.","['Психологический триллер', 'Тайна ожидания', 'Драма', 'Тайна', 'Триллер']",United States
137,Отец,2020,1h 37m,"Мужчина отказывается от всей помощи от своей дочери, когда он стареет. Когда он пытается понять, что происходит вокруг него, он начинает сомневаться","['Психологическая драма', 'Драма', 'Тайна']",United Kingdom
138,Всё о Еве,1950,2h 18m,"Казалось бы, робкая, но тайно безжалостная Инжене вмешается в жизнь стареющей звезды Бродвея и ее круга театральных друзей.","['Шоу -бизнес драма', 'Драма']",United States
139,Парк юрского периода,1993,2h 7m,"Промышленник приглашает некоторых экспертов посетить его тематический парк клонированных динозавров. После сбоя энергии существа бегают, укладывая жизнь каждого, включая его внуков, в ... Прочтите все","['Приключение динозавров', 'Джунгли Приключение', 'Действие', 'Приключение', 'Научная фантастика', 'Триллер']",United States
140,Нефть,2007,2h 38m,"История семьи, религии, ненависти, нефти и безумия, сосредоточенная на разведчике на рубеже веков в первые дни бизнеса.","['Эпический', 'Период драма', 'Психологическая драма', 'Трагедия', 'Драма']",United States
141,Казино,1995,2h 58m,"В Лас-Вегасе два лучших друзья-исполнительный директор казино и мафиозный сияющий-скомплектируются империей азартных игр и быстроживущем, быстро любящем светском происхождении.","['Docudrama', 'Эпический', 'Гангстер', 'Истинное преступление', 'Преступление', 'Драма']",United States
142,Шестое чувство,1999,1h 47m,"После того, как его застрелил бывшим пациентом, которого он не смог помочь, детский психолог из Филадельфии ищет искупления, обращаясь к молодому мальчику с тревожным секретом.","['Психологическая драма', 'Психологический триллер', 'Тайна ожидания', 'Драма', 'Тайна', 'Триллер']",United States
143,Ран,1985,2h 40m,"В средневековой Японии пожилой военачальник уходит на пенсию, передавая свою империю своим трем сыновьям. Тем не менее, он значительно недооценивает, как вновь обретенная сила испортит их, и заставит их перевернуть ... прочитать все","['Эпический', 'Самурай', 'Трагедия', 'Военный эпический', 'Действие', 'Драма', 'Война']",Japan
