,name,year,duration,description,genre,country
45,Подозрительные лица,1995,1h 46m,"Единственный выживший в результате перестрелки пирса рассказывает историю о том, как пресловутый преступник повлиял на события, которые начались с пяти преступников, собравшихся в кажущейся случайной полицейской линейке.","['Капер', 'Гангстер', 'Ограбление', 'Психологическая драма', 'Психологический триллер', 'Тайна ожидания', 'Whodunnit', 'Преступление', 'Драма', 'Тайна']",United States
46,1+1,2011,1h 52m,"После того, как он становится четырехлетним из аварии на парапланеринге, аристократ нанимает молодого человека из проектов, чтобы он был его попечителем.","['Docudrama', 'Комедия', 'Драма']",France
47,Новый кинотеатр «Парадизо»,1988,2h 54m,"Сальваторе, известный режиссер, возвращается в свой родной город на похороны резокриста местного театра Альфредо. Он вспоминает о своей жизни, когда молодой мальчик влюбился с ... читайте все","['Совершеннолетие', 'Драма', 'Роман']",Italy
48,Новые времена,1936,1h 27m,Бродяга изо всех сил пытается жить в современном промышленном обществе с помощью молодой бездомной женщины.,"['Романтическая комедия', 'Сатира', 'Защелка', 'Комедия', 'Драма', 'Роман']",United States
49,Чужой,1979,1h 57m,После изучения таинственной передачи неизвестного происхождения экипаж коммерческого космического корабля встречает смертельную форму жизни.,"['Инопланетное вторжение', 'Киберпанк', 'Монстр ужас', 'Космическая научная фантастика', 'Ужас', 'Научная фантастика']",United Kingdom
50,Окно во двор,1954,1h 52m,"Скучный фотограф, выздоравливающий от сломанной ноги, проходит время, наблюдая за своими соседями и начинает подозревать одного из них об убийстве.","['Психологический триллер', 'Тайна ожидания', 'Драма', 'Тайна', 'Триллер']",United States
51,Однажды на Диком Западе,1968,2h 46m,"Загадочный незнакомец с гармоникой объединяет усилия с печально известным отчаянием, чтобы защитить прекрасную вдову от безжалостной убийцы, работающей на железной дороге.","['Пустынное приключение', 'Эпический', 'Спагетти Вестерн', 'Западный Эпик', 'Драма', 'Западный']",Italy
52,Джанго освобождённый,2012,2h 45m,"С помощью немецкой охотника за щедрости, освобожденный раб, который собирается спасти свою жену от жестокого владельца плантации в Миссисипи.","['Темная комедия', 'Эпический', 'Период драма', 'Западный Эпик', 'Западный']",United States
53,Огни большого города,1931,1h 27m,"С помощью богатого беспорядочного Tippler, бродяги с влажными глазами, который влюбился в невидимую цветочную девушку, накапливает деньги, чтобы помогать ей медицинской помощи.","['Хороший роман', 'Романтическая комедия', 'Сатира', 'Защелка', 'Комедия', 'Драма', 'Роман']",United States
54,Апокалипсис сегодня,1979,2h 27m,"Офицеру армии США, служащего во Вьетнаме, поручено убийство полковника спецназа Renegade, который считает себя Богом.","['Приключенческий эпос', 'Эпический', 'Вершинный детектив', 'Психологическая драма', 'Квест', 'Тайна ожидания', 'Военный эпический', 'Драма', 'Тайна', 'Война']",United States
55,Дюна: Часть вторая,2024,2h 46m,"Пол Атрейдес объединяется с Фременом, находясь на пути мести, отомстив заговорщикам, которые уничтожили его семью. Столкнувшись с выбором между любовью всей его жизни и судьбой Вселенной ... Прочтите все","['Действие Эпик', 'Пустынное приключение', 'Эпический', 'Научно-фантастическая эпопея', 'Космическая научная фантастика', 'Действие', 'Приключение', 'Драма', 'Научная фантастика']",United States
56,Помни,2000,1h 53m,"Леонард Шелби, следователь по страхованию, страдает от антероградной амнезии и использует заметки и татуировки, чтобы охотиться за человеком, который, по его мнению, убил его жену, что является последним, что он помнит.","['Психологический триллер', 'Тайна ожидания', 'Тайна', 'Триллер']",United States
57,ВАЛЛ·И,2008,1h 38m,"Робот, который отвечает за очистку покрытой отходом земля, встречает другого робота и влюбляется в нее. Вместе они отправились в путешествие, которое изменит судьбу человечества.","['Приключенческий эпос', 'Искусственный интеллект', 'Компьютерная анимация', 'Дистопическая научная фантастика', 'Космическая научная фантастика', 'Приключение', 'Анимация', 'Семья', 'Научная фантастика']",United States
58,Индиана Джонс: В поисках утраченного ковчега,1981,1h 55m,"В 1936 году археологи и авантюристы правительства США наняли Индиана Джонс, чтобы найти Ковчег Завета, прежде чем нацисты смогли получить свои необычайные полномочия.","['Приключенческий эпос', 'Пустынное приключение', 'Globetrotting Adventure', 'Квест', 'Действие', 'Приключение']",United States
59,Жизнь других,2006,2h 17m,"В 1984 году в Восточном Берлине агент секретной полиции, проводящего наблюдение за писателем и его любовником, становится все более поглощенным своей жизнью.","['Политический триллер', 'Психологическая драма', 'Шпион', 'Драма', 'Тайна', 'Триллер']",Germany
60,Мстители: Война бесконечности,2018,2h 29m,"Мстители и их союзники должны быть готовы пожертвовать всеми в попытке победить могущественных Таноса, прежде чем его блиц разрушительного и руина положит конец вселенной.","['Космическая научная фантастика', 'Супергерой', 'Действие', 'Приключение', 'Научная фантастика']",United States
61,Сансет бульвар,1950,1h 50m,"Сценарист развивает опасные отношения с выцветшей кинозвездой, решившей, чтобы сделать триумфальное возвращение.","['Темная комедия', 'Фильм нуар', 'Психологическая драма', 'Шоу -бизнес драма', 'Трагедия', 'Драма']",United States
62,Человек-паук: Через Вселенные,2018,1h 57m,"Teen Miles Morales становится Человеком-пауком своей вселенной и должен присоединиться к пять человек с пауками из других измерений, чтобы остановить угрозу для всех реалий.","['Компьютерная анимация', 'Супергерой', 'Сверхъестественная фантазия', 'Подростковое приключение', 'Городское приключение', 'Действие', 'Приключение', 'Анимация', 'Комедия', 'Семья']",Canada
63,Тропы славы,1957,1h 28m,"Полковник защищает трех своих солдат в военном суде после того, как они отказываются от суицидальной атаки.","['Эпический', 'Психологическая драма', 'Военный эпический', 'Драма', 'Война']",United States
64,Свидетель обвинения,1957,1h 56m,"Ветеран британский адвокат должен защищать своего клиента в ходе судебного разбирательства, который удивил после удивления.","['Юридическая драма', 'Легальный триллер', 'Whodunnit', 'Преступление', 'Драма', 'Тайна', 'Триллер']",United States
65,Сияние,1980,2h 26m,"Семья направляется в изолированный отель на зиму, где зловещее присутствие влияет на отца на насилие. В то же время его экстрасенс","['Темная комедия', 'Психологическая драма', 'Психологический ужас', 'Сверхъестественный ужас', 'Драма', 'Ужас']",United Kingdom
66,Великий диктатор,1940,2h 5m,"Диктатор Аденоид Хинкель пытается расширить свою империю, в то время как бедный еврейский парикмахер пытается избежать преследований с режима Хинкеля.","['Пародия', 'Сатира', 'Защелка', 'Комедия', 'Драма', 'Война']",United States
67,12-я неудача,2023,Vidhu Vinod Chopra,Реальная история офицера IPS Маноджа Кумара Шарма и офицера IRS Шраддха Джоши.,"['Docudrama', 'Биография', 'Драма']",India
68,Чужие,1986,2h 17m,"Через десятилетия после выживания инцидента с Ностромо Эллен Рипли отправляют, чтобы восстановить контакт с терраформирующей колонией, но она сражается с королевой инопланетян и ее потомством.","['Инопланетное вторжение', 'Киберпанк', 'Монстр ужас', 'Космическая научная фантастика', 'Выживание', 'Трагедия', 'Действие', 'Приключение', 'Ужас', 'Научная фантастика']",United Kingdom
69,Бесславные ублюдки,2009,2h 33m,Во время Второй мировой войны во время Второй мировой войны план убийства нацистских лидеров группой еврейских солдат США совпадает с мстительными планами владельца театра на то же самое.,"['Темная комедия', 'Период драма', 'Приключение', 'Драма', 'Война']",United States
70,Тёмный рыцарь: Возрождение легенды,2012,2h 44m,"Бэйн, внушительный террорист, нападает на Готэм-Сити и нарушает свой восьмилетний период мира. Это заставляет Брюса Уэйна выйти из скрытия и снова надеть накидку и капот Бэтмена.","['Действие Эпик', 'Эпический', 'Супергерой', 'Действие', 'Драма', 'Триллер']",United States
71,Тайна Коко,2017,1h 45m,"Стремительный музыкант Мигель, столкнувшись с наследственным запретом своей семьи на музыку, входит в землю мертвых, чтобы найти своего пра-пра-дедушки, легендарного певца.","['Компьютерная анимация', 'Сверхъестественная фантазия', 'Приключение', 'Анимация', 'Драма', 'Семья', 'Фантастика', 'Музыка', 'Тайна']",United States
72,Амадей,1984,2h 40m,"Жизнь, успех и неприятности Вольфганга Амадея Моцарта, как сказал Антонио Сальери, современный композитор, который глубоко завидовал таланту Моцарта и утверждал, что убил его ... прочтите все","['Драма костюма', 'Эпический', 'Период драма', 'Трагедия', 'Биография', 'Драма', 'Музыка']",United States
73,История игрушек,1995,1h 21m,"Ковбойская кукла глубоко угрожает и завидует, когда новая фигура по борьбе с космосором вытесняет его в качестве лучшей игрушки в спальне мальчика.","['Приятель комедия', 'Компьютерная анимация', 'Сверхъестественная фантазия', 'Городское приключение', 'Приключение', 'Анимация', 'Комедия', 'Семья', 'Фантастика']",United States
74,Мстители: Финал,2019,3h 1m,"После разрушительных событий Мтситетели: ВОЕННАЯ БОСКОНЕГЕАНА (2018) вселенная находится в руинах. С помощью оставшихся союзников Мстители собираются еще раз, чтобы повернуть в виду Танос ... прочитать все","['Космическая научная фантастика', 'Супергерой', 'Путешествие во времени', 'Трагедия', 'Действие', 'Приключение', 'Научная фантастика']",United States
75,Умница Уилл Хантинг,1997,2h 6m,"У Уилл Хантинг, уборщик в MIT, есть подарок для математики, но нуждается в помощи психолога, чтобы найти направление в его жизни.","['Совершеннолетие', 'Психологическая драма', 'Драма', 'Роман']",United States
76,Олдбой,2003,2h,"После того, как он был похищен и заключен в тюрьму в течение пятнадцати лет, Огал Дэ-су освобождается, только чтобы обнаружить, что он должен отследить своего похитителя за пять дней.","['Темная комедия', 'Армия с одной личной армией', 'Психологическая драма', 'Психологический триллер', 'Действие', 'Драма', 'Тайна', 'Триллер']",South Korea
77,"Доктор Стрейнджлав, или Как я научился не волноваться и полюбил атомную бомбу",1964,1h 35m,"Мраво неуравновешенная американская общая приказывает к приступу водородной бомб на Советский Союз, инициируя путь к глобальному ядерному Холокосту, что военная комната, полная политиков и генералов, безумно ... прочитайте все","['Темная комедия', 'Фарс', 'Политическая драма', 'Сатира', 'Трагедия', 'Комедия', 'Война']",United Kingdom
78,Красота по-американски,1999,2h 2m,"Сексуально разочарованный пригородный отец имеет кризис в середине жизни после того, как он увлекся лучшим другом его дочери.","['Психологическая драма', 'Трагедия', 'Драма']",United States
79,Подводная лодка,1981,Wolfgang Petersen,"Немецкая подводная лодка преследует холодные воды Северной Атлантики, когда ее молодая команда испытывает ужас и клаустрофобную жизнь подводного лодка во Второй мировой войне.","['Эпический', 'Военный эпический', 'Драма', 'Война']",West Germany
80,Храброе сердце,1995,2h 58m,"Шотландский воин Уильям Уоллес ведет своих соотечественников в восстании, чтобы освободить свою родину от тирании короля Эдварда I из Англии.","['Действие Эпик', 'Драма костюма', 'Эпический', 'Период драма', 'Военный эпический', 'Биография', 'Драма', 'Война']",United States
81,Принцесса Мононоке,1997,2h 13m,"Стремясь вылечить себя от проклятия, молодой воин Ашитака наткнулся на конфликт между народом Железного Тауна и принцессой Мононоке, девушкой, воспитанной волками, которая остановится, не ... читать все","['Действие Эпик', 'Анимация для взрослых', 'Приключенческий эпос', 'Аниме', 'Темная фантазия', 'Фэнтезийный эпический', 'Нарисованная вручную анимацию', 'Квест', 'Приключение', 'Анимация']",Japan
82,Твоё имя,2016,1h 46m,"Двое подростков имеют глубокую, волшебную связь, обнаружив, что они меняют тела. Все может стать еще сложнее, когда мальчик и девочка решают встретиться лично.","['Аниме', 'Shōjo', 'Анимация', 'Драма', 'Фантастика', 'Роман']",Japan
83,Рай и ад,1963,2h 23m,"Исполнительный директор обувной компании Yokohama становится жертвой вымогательства, когда сын его шофера похищен по ошибке и удерживается за выкуп.","['Полицейские процедурные', 'Преступление', 'Драма', 'Тайна', 'Триллер']",Japan
84,Три идиота,2009,2h 50m,"Двое друзей ищут своего давно потерянного спутника. Они возвращаются к своим студенческим дням и вспоминают воспоминания о своем другом, который вдохновил их думать по -другому, даже когда остальная часть Т ... прочитайте все","['Приятель комедия', 'Совершеннолетие', 'Причудливая комедия', 'Комедия', 'Драма']",India
85,Джокер,2019,2h 2m,"Артур Флек, клоун вечеринки и неудачный комик, ведет обнищавшую жизнь со своей больной матерью. Однако, когда общество избегает его и зафиксирует урод, он решает обнять ... читать все","['Психологическая драма', 'Психологический триллер', 'Трагедия', 'Преступление', 'Драма', 'Триллер']",United States
86,Однажды в Америке,1984,3h 49m,"Бывший еврейский гангстер эпохи запрета возвращается в нижнюю восточную сторону Манхэттена 35 лет спустя, где он должен снова противостоять призракам и сожалениям о своей старой жизни.","['Темная комедия', 'Эпический', 'Гангстер', 'Период драма', 'Преступление', 'Драма']",Italy
87,Капернаум,2018,2h 6m,"Отбывая пятилетний срок за насильственное преступление, 12-летний мальчик предъявляет иск своим родителям за пренебрежение.",['Драма'],Lebanon
88,Поющие под дождем,1952,1h 43m,"Звезда немой кино влюбляется в припевную девушку так же, как он и его бредовое ревнивое экранное партнер пытаются сделать трудный переход к говорящим картинкам в Голливуде 1920 -х годов.","['Классический мюзикл', 'Хороший роман', 'Музыкальный автомат', 'Романтическая комедия', 'Сатира', 'Комедия', 'Мюзикл', 'Роман']",United States
89,Иди и смотри,1985,2h 22m,"Найдя старую винтовку, молодой мальчик присоединяется к советскому движению сопротивления против безжалостных немецких сил и испытывает ужасы Второй мировой войны.","['Эпический', 'Период драма', 'Трагедия', 'Военный эпический', 'Драма', 'Триллер', 'Война']",Soviet Union
90,Реквием по мечте,2000,1h 42m,"Утопии, вызванные наркотиками четырех жителей Кони-Айленда, разрушены, когда их пристрастия проходят глубоко.","['Психологическая драма', 'Трагедия', 'Драма']",United States
91,История игрушек: Большой побег,2010,1h 43m,"Игрушки ошибочно доставляются в центр дневного ухода, а не на чердаке прямо перед тем, как Энди уходит в колледж, и Вуди должен убедить другие игрушки, что они не были брошены ... Прочтите все","['Компьютерная анимация', 'Сверхъестественная фантазия', 'Городское приключение', 'Приключение', 'Анимация', 'Комедия', 'Семья', 'Фантастика']",United States
92,Звёздные войны: Эпизод 6 - Возвращение Джедая,1983,2h 11m,"После спасения Хана Соло из Джабба Хатта, повстанческий альянс пытается уничтожить вторую звезду смерти, в то время как Люк изо всех сил пытается помочь Дарту Вейдеру вернуться с темной стороны.","['Действие Эпик', 'Приключенческий эпос', 'Темная фантазия', 'Эпический', 'Фэнтезийный эпический', 'Globetrotting Adventure', 'Квест', 'Научно-фантастическая эпопея', 'Космическая научная фантастика', 'Меч и колдовство']",United States
